[
  {
    "id": "who-health-hospitals-damaged-2025-05-07",
    "metric": "health.hospitals.damaged",
    "value": 33,
    "kind": "count",
    "bound": "exact",
    "source": "who",
    "as_of": "2025-05-07",
    "period_start": "2023-10-07",
    "period_end": "2025-05-07",
    "document": {
      "url": "https://www.emro.who.int/images/stories/palestine/Sitrep_58s.pdf",
      "publisher": "World Health Organization (oPt Emergency Situation Update)",
      "retrieved_at": "2026-10-19T15:09:40+00:00",
      "sha256": "6a66829c5512fa301e784019a1b2bf9bad95540cfac28a13c8b3580bc4db186f",
      "archive": "archive/2026/10/6a66829c5512fa30.pdf"
    },
    "quote": "Including 33 Hospitals damaged",
    "caveat": "Recorded by WHO's Surveillance System for Attacks on Health Care since 7 October 2023. WHO situation report issue 58.",
    "added_by": "importer:who"
  },
  {
    "id": "who-health-hospitals-damaged-2025-05-22",
    "metric": "health.hospitals.damaged",
    "value": 34,
    "kind": "count",
    "bound": "exact",
    "source": "who",
    "as_of": "2025-05-22",
    "period_start": "2023-10-07",
    "period_end": "2025-05-22",
    "document": {
      "url": "https://www.emro.who.int/images/stories/palestine/Sitrep_59.pdf",
      "publisher": "World Health Organization (oPt Emergency Situation Update)",
      "retrieved_at": "2026-10-19T15:09:39+00:00",
      "sha256": "948e40e155a8768304afda41977257b52484751a18eec31a53e95e3f7b53f4c7",
      "archive": "archive/2026/10/948e40e155a87683.pdf"
    },
    "quote": "Including 34 Hospitals damaged",
    "caveat": "Recorded by WHO's Surveillance System for Attacks on Health Care since 7 October 2023. WHO situation report issue 59.",
    "added_by": "importer:who"
  },
  {
    "id": "who-health-hospitals-damaged-2025-06-11",
    "metric": "health.hospitals.damaged",
    "value": 34,
    "kind": "count",
    "bound": "exact",
    "source": "who",
    "as_of": "2025-06-11",
    "period_start": "2023-10-07",
    "period_end": "2025-06-11",
    "document": {
      "url": "https://www.un.org/unispal/wp-content/uploads/2025/08/Sitrep_61.pdf",
      "publisher": "World Health Organization (oPt Emergency Situation Update)",
      "retrieved_at": "2026-10-19T14:52:44+00:00",
      "sha256": "55f2d63b0b87a97b124c3f1b9278b5e1afbc38cba6636f73acd0e2995252a561",
      "archive": "archive/2026/10/55f2d63b0b87a97b.pdf"
    },
    "quote": "Including 34 Hospitals damaged",
    "caveat": "Recorded by WHO's Surveillance System for Attacks on Health Care since 7 October 2023. WHO situation report issue 61.",
    "added_by": "importer:who"
  },
  {
    "id": "who-health-hospitals-damaged-2025-08-07",
    "metric": "health.hospitals.damaged",
    "value": 34,
    "kind": "count",
    "bound": "exact",
    "source": "who",
    "as_of": "2025-08-07",
    "period_start": "2023-10-07",
    "period_end": "2025-08-07",
    "document": {
      "url": "https://www.un.org/unispal/wp-content/uploads/2025/08/Sitrep_62.pdf",
      "publisher": "World Health Organization (oPt Emergency Situation Update)",
      "retrieved_at": "2026-10-19T14:52:45+00:00",
      "sha256": "6da84ab2216712237ea9579bd81a329527a40587b18a7b321d6e95c2a64a4e8f",
      "archive": "archive/2026/10/6da84ab221671223.pdf"
    },
    "quote": "Including 34 Hospitals damaged",
    "caveat": "Recorded by WHO's Surveillance System for Attacks on Health Care since 7 October 2023. WHO situation report issue 62.",
    "added_by": "importer:who"
  },
  {
    "id": "who-health-hospitals-damaged-2025-09-11",
    "metric": "health.hospitals.damaged",
    "value": 34,
    "kind": "count",
    "bound": "exact",
    "source": "who",
    "as_of": "2025-09-11",
    "period_start": "2023-10-07",
    "period_end": "2025-09-11",
    "document": {
      "url": "https://www.emro.who.int/images/stories/palestine/Sitrep_64.pdf",
      "publisher": "World Health Organization (oPt Emergency Situation Update)",
      "retrieved_at": "2026-10-19T15:09:35+00:00",
      "sha256": "b0fafe138179baaf712ee0780fdf0c81521f199b2529a4c2dcc00adff4af1dc3",
      "archive": "archive/2026/10/b0fafe138179baaf.pdf"
    },
    "quote": "Including 34 Hospitals damaged",
    "caveat": "Recorded by WHO's Surveillance System for Attacks on Health Care since 7 October 2023. WHO situation report issue 64.",
    "added_by": "importer:who"
  },
  {
    "id": "who-health-hospitals-damaged-2025-09-28",
    "metric": "health.hospitals.damaged",
    "value": 34,
    "kind": "count",
    "bound": "exact",
    "source": "who",
    "as_of": "2025-09-28",
    "period_start": "2023-10-07",
    "period_end": "2025-09-28",
    "document": {
      "url": "https://www.un.org/unispal/wp-content/uploads/2025/11/Sitrep_65.pdf",
      "publisher": "World Health Organization (oPt Emergency Situation Update)",
      "retrieved_at": "2026-10-19T14:52:46+00:00",
      "sha256": "163f6015f2f03e38ba5a89a04d60726f9139d87703991be0d8f61a06c6ee76e5",
      "archive": "archive/2026/10/163f6015f2f03e38.pdf"
    },
    "quote": "Including 34 Hospitals damaged",
    "caveat": "Recorded by WHO's Surveillance System for Attacks on Health Care since 7 October 2023. WHO situation report issue 65.",
    "added_by": "importer:who"
  },
  {
    "id": "who-health-hospitals-damaged-2025-10-31",
    "metric": "health.hospitals.damaged",
    "value": 34,
    "kind": "count",
    "bound": "exact",
    "source": "who",
    "as_of": "2025-10-31",
    "period_start": "2023-10-07",
    "period_end": "2025-10-31",
    "document": {
      "url": "https://www.emro.who.int/images/stories/palestine/sitrep66.pdf",
      "publisher": "World Health Organization (oPt Emergency Situation Update)",
      "retrieved_at": "2026-10-19T14:52:24+00:00",
      "sha256": "589a0b5a248c3fcdad8786d94664921cd16c2353a2a2261a0e298e5d7fd489cf",
      "archive": "archive/2026/10/589a0b5a248c3fcd.pdf"
    },
    "quote": "Including 34 Hospitals damaged",
    "caveat": "Recorded by WHO's Surveillance System for Attacks on Health Care since 7 October 2023. WHO situation report issue 66.",
    "added_by": "importer:who"
  },
  {
    "id": "who-health-hospitals-damaged-2026-01-31",
    "metric": "health.hospitals.damaged",
    "value": 36,
    "kind": "count",
    "bound": "exact",
    "source": "who",
    "as_of": "2026-01-31",
    "period_start": "2023-10-07",
    "period_end": "2026-01-31",
    "document": {
      "url": "https://www.emro.who.int/images/stories/palestine/Sitrep_68.pdf",
      "publisher": "World Health Organization (oPt Emergency Situation Update)",
      "retrieved_at": "2026-10-19T15:09:33+00:00",
      "sha256": "146f1ab9a99caee5d0100033de1965720afa8d3a7579213d90df845e064e464b",
      "archive": "archive/2026/10/146f1ab9a99caee5.pdf"
    },
    "quote": "Including 36 Hospitals damaged",
    "caveat": "Recorded by WHO's Surveillance System for Attacks on Health Care since 7 October 2023. WHO situation report issue 68.",
    "added_by": "importer:who"
  }
]
