[
  {
    "id": "un2720-aid-un2720-trucks-intercepted-2025-05-31-20250501",
    "metric": "aid.un2720.trucks_intercepted",
    "value": 212,
    "kind": "count",
    "bound": "exact",
    "source": "un2720",
    "as_of": "2025-05-31",
    "period_start": "2025-05-01",
    "period_end": "2025-05-31",
    "document": {
      "url": "https://info.un2720.org/assets/images/reports-infographics/Monthly%20Infographic(May).pdf",
      "publisher": "UN2720 Mechanism (UNOPS)",
      "retrieved_at": "2026-10-20T14:22:42+00:00",
      "sha256": "0bb680a2357c6517ed14f28238c27881c4fb83429b37112689cae6830200844e",
      "archive": "archive/2026/10/0bb680a2357c6517.pdf"
    },
    "quote": "212 Intercepted 118 Arrived Trucks Trucks",
    "caveat": "Only UN-manifested aid. Collected trucks are those picked up from Gaza's crossings; arrived and intercepted split them. The report's text places these labels and numbers apart; the reading follows its layout.",
    "added_by": "importer:un2720"
  },
  {
    "id": "un2720-aid-un2720-trucks-intercepted-2025-06-30-20250601",
    "metric": "aid.un2720.trucks_intercepted",
    "value": 1043,
    "kind": "count",
    "bound": "exact",
    "source": "un2720",
    "as_of": "2025-06-30",
    "period_start": "2025-06-01",
    "period_end": "2025-06-30",
    "document": {
      "url": "https://info.un2720.org/assets/images/reports-infographics/Monthly%20Infographic(June).pdf",
      "publisher": "UN2720 Mechanism (UNOPS)",
      "retrieved_at": "2026-10-20T14:22:33+00:00",
      "sha256": "6df521557d947f16e5248b2bad2c7be747ecb0c63c9c018c8e3461a14e6cce16",
      "archive": "archive/2026/10/6df521557d947f16.pdf"
    },
    "quote": "1,043 Trucks Intercepted 47 Trucks Arrived",
    "caveat": "Only UN-manifested aid. Collected trucks are those picked up from Gaza's crossings; arrived and intercepted split them.",
    "added_by": "importer:un2720"
  },
  {
    "id": "un2720-aid-un2720-trucks-intercepted-2025-07-31-20250519",
    "metric": "aid.un2720.trucks_intercepted",
    "value": 1753,
    "kind": "count",
    "bound": "exact",
    "source": "un2720",
    "as_of": "2025-07-31",
    "period_start": "2025-05-19",
    "period_end": "2025-07-31",
    "document": {
      "url": "https://www.algemeiner.com/2025/08/01/un-data-nearly-90-percent-gaza-aid-intercepted-before-reaching-intended-recipients/",
      "publisher": "Algemeiner, citing the UN2720 dashboard",
      "retrieved_at": "2026-10-19"
    },
    "added_by": "seed",
    "caveat": "Exact end date not stated in the report; dashboard read at the end of July 2025."
  },
  {
    "id": "un2720-aid-un2720-trucks-intercepted-2025-07-31-20250701",
    "metric": "aid.un2720.trucks_intercepted",
    "value": 1055,
    "kind": "count",
    "bound": "exact",
    "source": "un2720",
    "as_of": "2025-07-31",
    "period_start": "2025-07-01",
    "period_end": "2025-07-31",
    "document": {
      "url": "https://info.un2720.org/assets/images/reports-infographics/Monthly%20Infographic(July).pdf",
      "publisher": "UN2720 Mechanism (UNOPS)",
      "retrieved_at": "2026-10-20T14:22:42+00:00",
      "sha256": "41b87f5e591a85ae0f5f02680155e0d2e0d487efb5c1cea2aa9843fb587b0789",
      "archive": "archive/2026/10/41b87f5e591a85ae.pdf"
    },
    "quote": "Arrived Intercepted 73Trucks 1,055 Trucks",
    "caveat": "Only UN-manifested aid. Collected trucks are those picked up from Gaza's crossings; arrived and intercepted split them. The report's text places these labels and numbers apart; the reading follows its layout. Replaces a news report (Algemeiner) of a 19 May to 31 July 2025 total read from the UN2720 dashboard; UN2720's own monthly reports are used instead, one figure per month.",
    "added_by": "importer:un2720",
    "supersedes": "un2720-aid-un2720-trucks-intercepted-2025-07-31-20250519"
  },
  {
    "id": "un2720-aid-un2720-trucks-intercepted-2025-08-31-20250801",
    "metric": "aid.un2720.trucks_intercepted",
    "value": 2797,
    "kind": "count",
    "bound": "exact",
    "source": "un2720",
    "as_of": "2025-08-31",
    "period_start": "2025-08-01",
    "period_end": "2025-08-31",
    "document": {
      "url": "https://info.un2720.org/assets/images/reports-infographics/Monthly%20Infographic(August).pdf",
      "publisher": "UN2720 Mechanism (UNOPS)",
      "retrieved_at": "2026-10-20T14:22:41+00:00",
      "sha256": "5db227bb650ea20844df4b02791fef86e4f7db09bda989a9765ac9a3cf68fe3c",
      "archive": "archive/2026/10/5db227bb650ea208.pdf"
    },
    "quote": "Arrived 589 Trucks Intercepted 2,797 Trucks",
    "caveat": "Only UN-manifested aid. Collected trucks are those picked up from Gaza's crossings; arrived and intercepted split them.",
    "added_by": "importer:un2720"
  },
  {
    "id": "un2720-aid-un2720-trucks-intercepted-2025-09-30-20250901",
    "metric": "aid.un2720.trucks_intercepted",
    "value": 1491,
    "kind": "count",
    "bound": "exact",
    "source": "un2720",
    "as_of": "2025-09-30",
    "period_start": "2025-09-01",
    "period_end": "2025-09-30",
    "document": {
      "url": "https://info.un2720.org/assets/images/reports-infographics/Monthly%20Infographic(Sep).pdf",
      "publisher": "UN2720 Mechanism (UNOPS)",
      "retrieved_at": "2026-10-20T14:22:40+00:00",
      "sha256": "37e54bf3fb3132f0b7ad2e376c95e77bfcf00950936bd93a2a4d3e3b6afc0a70",
      "archive": "archive/2026/10/37e54bf3fb3132f0.pdf"
    },
    "quote": "Arrived 772 Trucks Intercepted 1,491 Trucks",
    "caveat": "Only UN-manifested aid. Collected trucks are those picked up from Gaza's crossings; arrived and intercepted split them.",
    "added_by": "importer:un2720"
  },
  {
    "id": "un2720-aid-un2720-trucks-intercepted-2025-10-31-20251001",
    "metric": "aid.un2720.trucks_intercepted",
    "value": 442,
    "kind": "count",
    "bound": "exact",
    "source": "un2720",
    "as_of": "2025-10-31",
    "period_start": "2025-10-01",
    "period_end": "2025-10-31",
    "document": {
      "url": "https://info.un2720.org/assets/images/reports-infographics/Monthly%20Infographic(Oct).pdf",
      "publisher": "UN2720 Mechanism (UNOPS)",
      "retrieved_at": "2026-10-20T14:22:39+00:00",
      "sha256": "49d8e103de46187afd6fa0016a8a3887b0ed75106dfedc66de2f2b3fa5d450df",
      "archive": "archive/2026/10/49d8e103de46187a.pdf"
    },
    "quote": "Arrived 2,343 Trucks Intercepted 442 Trucks",
    "caveat": "Only UN-manifested aid. Collected trucks are those picked up from Gaza's crossings; arrived and intercepted split them.",
    "added_by": "importer:un2720"
  },
  {
    "id": "un2720-aid-un2720-trucks-intercepted-2025-11-30-20251101",
    "metric": "aid.un2720.trucks_intercepted",
    "value": 22,
    "kind": "count",
    "bound": "exact",
    "source": "un2720",
    "as_of": "2025-11-30",
    "period_start": "2025-11-01",
    "period_end": "2025-11-30",
    "document": {
      "url": "https://info.un2720.org/assets/images/reports-infographics/Monthly%20Infographic(Nov).pdf",
      "publisher": "UN2720 Mechanism (UNOPS)",
      "retrieved_at": "2026-10-20T14:22:38+00:00",
      "sha256": "c595dba28430d5c364bd63b24f9ebb4dfc92b6f386e4bb3280694a9fe07d9c09",
      "archive": "archive/2026/10/c595dba28430d5c3.pdf"
    },
    "quote": "Arrived 4,068 Trucks Intercepted 22 Trucks",
    "caveat": "Only UN-manifested aid. Collected trucks are those picked up from Gaza's crossings; arrived and intercepted split them.",
    "added_by": "importer:un2720"
  }
]
